<?xml version="1.0" encoding="UTF-8"?>

<!--L
  Copyright Washington University at St. Louis

  Distributed under the OSI-approved BSD 3-Clause License.
  See http://ncip.github.com/geneconnect/LICENSE.txt for details.
L-->

<!DOCTYPE CommandFile SYSTEM "CommandFile.dtd">
<CommandFile>
	<DataSource name="UNIPROT_DESTINATION_FASTA" type="FTP" siteurl="ftp.uniprot.org" 
	 	username="anonymous" password="phataka@pathbox.wustl.edu">
	 	<ExternalParser writeToDB="false" commandfile="ParserScripts/FormatdbUniprot.sh"/>
	<BaseDirectory dir="/pub/databases/uniprot/current_release/knowledgebase/complete/" islocal="false">
	 		<File name="uniprot_sprot.fasta.gz"/>
			<File name="uniprot_trembl.fasta.gz"/>
	 	</BaseDirectory>		
 	</DataSource-->
 	<DataSource name="REFSEQPROTEIN" type="FTP" siteurl="ftp.ncbi.nih.gov" 
	 	username="anonymous" password="phataka@pathbox.wustl.edu">
	 	<ExternalParser writeToDB="false" commandfile="ParserScripts/FormatdbRefSeqProt.sh"/>
		<BaseDirectory dir="/refseq/H_sapiens/mRNA_Prot/" islocal="false">
	 		<File name="human.protein.faa.gz"/>
	 	</BaseDirectory>		
 	</DataSource>
	<DataSource name="REFSEQMRNA" type="FTP" siteurl="ftp.ncbi.nih.gov" 
	 	username="anonymous" password="phataka@pathbox.wustl.edu">
	 	<ExternalParser writeToDB="false" commandfile="ParserScripts/FormatdbRefSeqmRNA.sh"/>
		<BaseDirectory dir="/refseq/H_sapiens/mRNA_Prot/" islocal="false">
	 		<File name="human.rna.fna.gz"/>
	 	</BaseDirectory>		
 	</DataSource>
	<DataSource name="ENSEMBLTRANSCRIPT" type="FTP" siteurl="ftp.ensembl.org" 
	 	username="anonymous" password="phataka@pathbox.wustl.edu">
	 	<ExternalParser writeToDB="false" commandfile="ParserScripts/FormatdbEnsemblTrans.sh"/>
		<BaseDirectory dir="/pub/current_homo_sapiens/data/fasta/cdna/
" islocal="false">
	 		<File name="Homo_sapiens.NCBI36.40.cdna.all.fa.gz"/>
	 	</BaseDirectory>		
 	</DataSource>
	<DataSource name="ENSEMBLPROTEIN" type="FTP" siteurl="ftp.ensembl.org" 
	 	username="anonymous" password="phataka@pathbox.wustl.edu">
	 	<ExternalParser writeToDB="false" commandfile="ParserScripts/FormatdbEnsemblProt.sh"/>
		<BaseDirectory dir="/pub/current_homo_sapiens/data/fasta/pep/" islocal="false">
	 		<File name="Homo_sapiens.NCBI36.40.pep.all.fa.gz"/>
	 	</BaseDirectory>		
 	</DataSource>
	<DataSource name="GENEBANK PROTEIN" type="" siteurl="D:" 
	 	username="anonymous" password="phataka@pathbox.wustl.edu">
	 	<ExternalParser writeToDB="false" commandfile="ParserScripts/GenbankProteinParser.bat"/>
		<BaseDirectory dir="\WashU\code\UniGeneParser" islocal="true">
	 		<File name="gbankproteinTestfile.dat"/>
	 	</BaseDirectory>		
 	</DataSource>
	<DataSource name="GENEBANK MRNA" type="" siteurl="D:" 
	 	username="anonymous" password="phataka@pathbox.wustl.edu">
	 	<ExternalParser writeToDB="false" commandfile="ParserScripts/GenbankmRNAParser.bat"/>
		<BaseDirectory dir="\WashU\code\UniGeneParser" islocal="true">
	 		<File name="gbankmrnaTestFile.dat"/>
	 	</BaseDirectory>		
 	</DataSource>
</CommandFile>