<?xml version="1.0" encoding="UTF-8"?>

<!--L
  Copyright Washington University at St. Louis

  Distributed under the OSI-approved BSD 3-Clause License.
  See http://ncip.github.com/geneconnect/LICENSE.txt for details.
L-->

<!DOCTYPE CommandFile SYSTEM "CommandFile.dtd">
<CommandFile>

	<DataSource name="REFSEQ_MRNA" type="HTTP" siteurl="" 
	 	username="" password="" proxyhost="" proxyport="">
	 	<ExternalParser writeToDB="false" commandfile="ParserScripts/RefSeqmRNA-XML_RPC_Client.sh"/>
		<BaseDirectory dir="/GeneConnect/" islocal="true">
	 		<File name="human.rna.fna"/>
	 	</BaseDirectory>		
 	</DataSource>

	<DataSource name="REFSEQ_PROTEIN" type="HTTP" siteurl="" 
	 	username="" password="" proxyhost="" proxyport="">
	 	<ExternalParser writeToDB="false" commandfile="ParserScripts/RefSeqProtein-XML_RPC_Client.sh"/>
		<BaseDirectory dir="/GeneConnect/" islocal="true">
	 		<File name="human.protein.faa"/>
	 	</BaseDirectory>		
 	</DataSource>

	<DataSource name="UNIPROT" type="HTTP" siteurl="" 
	 	username="" password="" proxyhost="" proxyport="">
	 	<ExternalParser writeToDB="false" commandfile="ParserScripts/UniProtKB-XML_RPC_Client.sh"/>
		<BaseDirectory dir="/GeneConnect/" islocal="true">
	 		<File name="uniprot_HUMAN.fasta"/>
	 	</BaseDirectory>		
 	</DataSource>

	<DataSource name="GENEBANK PROTEIN" type="" siteurl="" 
	 	username="" password="">
	 	<ExternalParser writeToDB="false" commandfile="ParserScripts/GenBankProtein-XML_RPC_Client.sh"/>
		<BaseDirectory dir="\WashU\code\UniGeneParser" islocal="true">
	 		<File name="genbank_protein_Homo_sapiens.fasta"/>
	 	</BaseDirectory>		
 	</DataSource>
	
	<DataSource name="GENEBANK MRNA" type="" siteurl="" 
	 	username="" password="">
	 	<ExternalParser writeToDB="false" commandfile="ParserScripts/GenBankmRNA-XML_RPC_Client.sh"/>
		<BaseDirectory dir="\WashU\code\UniGeneParser" islocal="true">
			<File name="genbank_mRNA_Homo_sapiens.fasta"/>
	 	</BaseDirectory>		
 	</DataSource> 
</CommandFile>